,0,1
504,74,I bet it was only in the 40s.. we didn t know what cold was yet!! ??
505,74,This is such an awesome bundle! Basically buy a warmer get 3 bars free! Which one would you choose?
506,74,We had Hannahs birthday party today.. thanks y all for coming and celebrating with our girl! We had fun and Hannah is loving all of her gifts!
507,74,"Happy 4th Birthday to our smart, silly, ridiculously fearless, beautiful girl! Love you Hannah! Can t believe you are 4 already!"
508,74,Trick or treating was cold!
509,74,"Today was a big day for Hannah!.. she lost her first tooth.
It has been loose since August and fell out naturally. We tried to keep it in til she turned 4.. but it got a little too loose and fell out while she was at school this morning."
510,74,Hannah s first day of preschool! She is soooo excited!
511,74,Enjoyed a stroll by the river for the Luminara walk!
512,74,Hannah had her first  big girl  dentist appointment today! She did soooo good! Way better than her last dentist appointment! Still no cavities ???????? but she already has a loose tooth!! ????
513,74,Unicorn lovers!! Check out this months warmer!
514,76,Thanks Everyone!!!!
515,78,Well I conquered my last finance class it was a tough one but I like a challenge! One more 2 week psychology class and I am DONE!!!
516,78,We just got a package from G. Bowcut! I love our ornament! And I'm excited for the chocolate countdown calendar! The boys had to make up the days they missed and eat 5 chocolates today!
517,78,I HATE driving in the snow!! And why does everyone here park on the damn curb? If I'm sliding around I'd rather hit a curb than a car! And of course it had to rain before we get dumped on with snow so everything is so slick!
518,78,Me and Tay playing in the snow! I'm afraid it's here to stay this time!
519,78,I feel so accomplished! I just got two assignments done tonite! Even after I got to be lazy all day and hang out with Rachael Curtiss!
520,78,Love my new coat just what I needed for these freezing winters! Thanks Nick Graff your the best you always know how to make me happy!!
521,78,I am beyond frustrated with my homework not my idea of a fun Sunday afternoon
522,78,"Deep cleaned my house today, got all my Christmas decorations up, and got caught up on homework....I'm exhausted!"
523,78,"Helping Dad at the rock shop! Boulders are future firepits, Taysons so scared of the forklift!:)"
524,78,Fun night trick or treating!! Happy Halloween!
525,78,Sent Nick Graff to the store for cream cheese...and this is what he came back with! Made my day!!
526,78,"Such a nice fall day today! Pumpkin patch, raking leaves, walk with the dog!"
527,78,Got a babysitter tonite... Going out to paint the town with Nick Graff!
528,78,First haircut in 10 years not done by somebody I know! Kay-Lee B. Marie I needed you! Just cut 3 in off it was driving me crazy!
529,78,I just love my puppy! She's nice and clean just got done taking a bath!
530,78,"Just finished up a 10 hour day of homework...two risk and return analysis papers later and I am DONE! Now to prepare for my final this week, it never ends!"
531,78,Just when I was losing hope about my paper... It hit me I understand how to do it! Now I'm on a roll! This investment portfolio class is killing me!!
532,78,Fun day with the family!!
533,79,"I know I change my picture a lot, I just can't find one I like."
534,80,Facebook your lame
535,80,Skype...who'd a thought
536,80,Some day lol
537,80,"Playas play, I boss."
538,80,"Sadly I need to find a new home for my dog precious. She's spade and house trained and good with other dogs as well as little kids. She's a good dog, no aggressiveness at all."
539,80,Anybody else having cell service issues...?
540,80,"craigslist is packed full of fraud, southern Utah should deeply consider using KSL.com classifieds"
541,80,Hematoma mmmmmm good fml
542,80,Happy Birthday to my amazing wife & best friend... love you alana
543,80,Everybody look directly at the sun...... !
544,80,Frank Sinatra your my hero
545,80,Keep all the phones in my inventory and ill sale em ... Dang! Lowell harris could manage inventory better then these bustas :)
546,80,dude eff the red cliffs mall
547,80,"I need advise, I need to get a book on the internet, any ideas?"
548,80,hard labor mmm good
549,80,Blackberry kicks ass
550,80,I hate to say it but I have to find a new home for my dog. If anyone is looking for a great dog lets know.
551,80,Money and family = Bullshit. never let it get in the way... Family+Forgive+Forget=Love..all you need is love in life not money.
552,80,Sucks the family is everywhere but here. Be bad ass if all where in the same city.
553,80,We came we saw we kicked its ass!
554,80,Bitch
555,81,Had some fun at the park today
556,81,Trying to stay busy while mom was getting her hair done..
557,81,Dylans first Halloween
558,81,We had a fun day while mom was at work
559,81,Rough day while mom was at work
560,81,He is a handsome Lil stud
561,81,To spoiled
562,81,Shaun Dylan Harney 7 pounds 11 ounces 20 inches happy healthy baby boy and proud momma
563,81,Happy birthday Gracie girl . Nice hat makes your uncle proud
564,85,My yiddle nixon
565,85,Its me I am that friend
566,85,MUST WATCH I FREAKING LOVE THIS GIRL however we tell Nixon to never hit back but this girls got it all figured out man
567,85,this is is in 40 years ha ha ha ha I'm the one on the phone calling just to bug you two lol
568,85,I love this one too thanks facebook memories
569,85,Awe helping uncle Allen so cute
570,85,So funny I literally cried
571,85,My favorite little cinco de mayo dress ever
572,85,Best friends make the very best Lovers ??
573,87,unstantext
574,90,the stupid train keeps going
575,90,cant we all just get along
576,90,it is soo hot
577,90,fun wait for a hour for nothing
578,90,"""you cant trust somebody who thinks you are crazy"""
579,90,tan tee how i hate you
580,90,so i dont know if i should post some things anyone know anything about this note app on here security wise?
581,90,"I ask that all legal gun owners put this on their wall. The Supreme Court of the United States has affirmed that the right to keep and bear arms is a fundamental right of the individual... If you believe in the 2nd amendment, and you are not afraid to show it, repost this!!!... I hope to see this re-posted by a lot of my friends"
582,90,its so freaking hot i dont know what to do with myself
583,90,i just downloaded skype
584,90,"""and he says I swear I'm not the devil but you think I am"""
585,90,I hate freaking roumours especially about something so serious
586,90,"Sometimes I wish I was elsewhere, anywhere"
587,90,Freedom was never free it's because of the rough men and women visit those that would do us harm
588,90,"It is said some lives are linked across time, connected by an ancient calling that echoes through the ages"
589,90,So I realized today I was a very mad little kid and the hate grew as I did and what was the natural remedy? Copenhagen who would have thunk it! Haha
590,90,I hate my car four hours of work pulled dash apart and steering column and still can't figure it out
591,91,It was an awesome year indeed!
592,91,We are looking for a few solid clients that would like some results like these below for their business. We do have health and wellness down but if you have a business in another niche lets chat and see what we can do
593,91,Whoa whoa whoa Nolan no need to take it back to 8th grade... hahaha
594,91,Kids are pretty awesome!
595,92,my hurr is getting too long again
596,92,good day for fun in the sun!
597,92,"today was a good day! thanks james, courtney, jojo and others. I know who my true friends are."
598,92,no work today. looks like I'm playing in the water again
599,92,I'm getting one of these next week
600,92,my ribs are all bruised from jumping off scetchy cliffs in to a scetchy river pool. It was well worth it
601,92,Hot tub at the condo where we stayed
602,93,I'm trying to start up a business and need some investors to help me out. I'm going to try and open it in March so if anyone wants to help me out and get a very good deal on the pay back let me know. Again I need so help from my friends and family on this business i'm starting up.
603,93,"My family do you or can you find picture of ?uncle chariles house?ff04? in Summit before the fire? I have a design for the new house that looks just like it, but I need a picture to make sure that the design is right. send the pictures to my email. bar_wc_ranch3@yahoo.com , thanks, Cory"
604,93,"My Gradution is today at 7pm. I am so happy to graduate, it has takin me 5 years to get an associates degree in drafting. Now I just need to find a job in drafting, (Houses, Buildings, Land, and Machanical)."
605,93,"Come out to the Washington Fair Grounds this weekend and support the kids at the Dixie Jr Livestock Show and Action. There will be alot of kids that live in this town. Come and buy a grain feed animal to put in your freeze or sell it back to support and the support animal well be sold to local food store in are area. Come out and have a fun time. Thursday 11am-5pm, Friday 9am-4pm, and Saturday 9am-3pm."
606,93,got a new computer for my architecture design. now im broke!!!
607,93,Just one of my favorite movies Rio Bravo
608,96,So many things happening. BRING IT ON! Me & my man can handle anything!
609,96,S.A.D. Nails lol
610,96,Going to a movie all by myself for the first time!
611,96,Going to go work out right now uugghh this is gonna be a toughy
612,96,Can't wait to see my family tonight! !
613,96,Bugged
614,96,I want an I phone!
615,96,Just had the funnest dinner ever!! Thanks everyone for such a good time!
616,96,I am so excited for tonight!! Dinner with the crew at chilis oohhhhh ya!!
617,96,I woke up this morning looking like cindy lou hew!
618,96,Everyone's having babies! I want one!!!
619,96,Woke up not feelin too fancy :(
620,96,Waiting for my lover to get home to a nice hot meal and the Christmas tree all lit up :)
621,96,Loved the movie "new years eve "! Now playing video games with Chris. Couldn't be happier
622,96,Today is going to be a long day but bring it on!!
623,96,Im getting my extentions out today eeee!
624,96,I swear 28 days out of the month my man is amazzzing!! Then there's the 2 days where I wish I could just lock him out uugghh.
625,97,It's good to be home!..... Again...
626,97,6 hours on a plane. Middle seat. Perfect.
627,97,Time to come home. Goodbye east coast.
628,97,Driving through New York City in the back of a car my mom is behind the wheel of.. Freighting..
629,97,Life satisfaction for nerds
630,97,I haven't been in Ohio since 1986. It feels good to be back.
631,97,"I'm listening to Shiny Toy Guns, loving it, and I'm not ashamed."
632,97,Coming home never felt so good...
633,97,This corn maze is confusing..
634,97,Who's down for "Paranormal Activity" tomorrow night (Thursday) at midnight??
635,99,December Winners????
636,99, Lol babe!!!! We learned something new today!
637,99,Pumpkin chuckin!!!
638,99, I am proud of you too! I am so grateful for the man you are today! I love you Bri
639,99,Oh my gosh! I have tears in my eyes! I love that babe!
640,102," Thank you, I love you all ??"
641,102,Love and miss you grandma
642,103,learning guitar is very hard and it hurts my fingers but mabey one day a song will come out of it
643,103,to much for lunch now I feel sick yuck
644,103,is having sad hart problems missin my friends in utah
645,103,I. should not be at the grocery store on christmas eve this place is carzy
646,103,i finally got my real engagement ring its sooo pretty
647,103,saras new favrite CD war paint by the black crowes go and by now unless ur lame and like crappy music :)
648,103,2 more days till utah oh utah i have a love hate relationship with you but its mostly hate
649,103,who here still has no idea what they want to do with their life? please dont let me be the only one
650,103,I want to make a snow man soooo bad
651,103,awww poor drunk clifford at least its not me this time
652,103,Off to work again not sure if I'm going to make it through the day  :-(
653,103,I hate being SICK!!!!!
654,103,Damn you cold weather! Feeling a skim itch
655,103,Stressing! Doesn't look like this eye twitch will be going away anytime soon
656,103,"Trying to get done work done with a teething baby, not an easy task"
657,103,Gahhh walking dead you make me crazy!
658,103,Ughhhh Christmas you have left me so fat! You beautiful jerk
659,108,"i love my familise, i love my kids."
660,109,"i love my familise, i love my kids."
661,110,This is a bittersweet moment for us. We listed our home last night.We are nervous and excited for our next adventure! We had two showings our first day. :) If you know anyone looking have them check it out and call us if they would like to walk through. Thank u all!
662,110,Woo woo!!! Go Utes!!! ????
663,110,Rest in Paradise Rossko!!! This community and your blue family miss you sweet boy! ?????????? ??
664,110,Please like my my comment in the original post and follow directions to nominate Rudy for a free massage from Melted Massage! ??
665,110,My heart is so sad! Prayers for Baton Rouge!
666,110,"There is so much ignorance in this country! I have a lot of opinions that I won't share, but in light of recent events, I thought I would share this text that I got from my sweet husband this evening."
667,110,Prayers for our family in blue!!! This country is broken! 
668,110,"I use to babysit Noah and his little sister Gracie! I grew up next to his Grandparents and got to know Noah's parents, Curt and Amy quite well! Thoughts and prayers to this amazing family! Noah will me missed!"
669,110,So I usually don't post much... Especially when it comes to politics. Check this out...
670,110,"""Behind my badge is a heart like yours. I bleed, I think, I love, and yes I can be killed. And although I am but one man, I have thousands of brothers and sisters who are the same as me. They will lay down their lives for me, and I them. We stand watch together. The thin-blue-line, protecting the prey from the predators, the good from the bad. We are the police."""
671,111,Never a dull moment in conversation catching up with these dolls
672,111,Just going to put it out there once. I don't like the 3D fiber lash trend. I just feel like they look gooey and icky. Kind of like you haven't washed your eye make up off in 2 months. Just saying.....
673,111,"Hey, anyone going to st George the 8th, 9th, or 10th or this month? I'd live to hitch a ride, just need a ride south"
674,111,Just counting down the days until I get to use my birthday present from Michael Rex. Its maybe only like 13 days until the Keith Urban concert. You could say I'm kind of excited.
675,111,"Here's your chance to win, just repost with the hashtag #jftsgiveaway and tag 4 friends. Thats all you have to do to qualify to win a free beautiful organic sunless tan, or gel nail service!! Thanks for your support!"
676,111,"Friends, I've got a favor to ask! Mike and I are making some changes at our house this summer. One big change is getting licensed to be a foster family. We will be furnishing our basement, including 2 bedrooms and a living room. I am looking for gently used furniture to use, dressers, mattresses for twin beds, etc. So anything you are looking to sell or give to the D.I. I'd possibly be willing to take off your hands :) Thanks in advance!"
677,111,This dress is gorgeous!! Perfect for a summer wedding!!
678,111,"Friday night home alone, how do I wisely use this time? Pretty much just want to order Chinese from JOYLUCK and sit in front of the tube. Too bad no one is here to join"
679,111,"Awesome dinner tonight! I made a cafe Rio soup replica- TASTY! And, even though the last thing I need is another treat I made very fattening very delicious Oreo truffles."
680,111,Anyone going to slc tonight?? And want to let me hitch a ride?
681,111,Any of you have a car Dolly I could borrow for the weekend..... or week depending on which end of the state u live? :)
682,111,So in love with the snow in my yard!
683,111,Alright bring on my first day at the new office. I'm a little sick but way stoked!
684,111,"So, already got the call back and guess what??? I GOT THE JOB!!!! wahoo!"
685,111,"OK. First job interview is over. Now waiting for the call, the crappy part."
686,111,My brother Peter Neilson - he is just plain funny. I basically love listening to him just cause he makes me laugh even when he doesn't mean to! Sooo great
687,111,"Ready, set, move! Oooh wait. That's not until tomorrow. I'm ready tho- wish we could get in the truck now."
688,111,Last day at the dentist office and first day at the home office. Its definitely going to be different....
689,111,"If the grass looks greener on the other side, Maybe its because you aren't taking care of your own grass- unknown"
690,111,"Well I'm finally ready to admit that I'm excited to move. Bring on the change and the new adventure. That's what everyone keeps telling me this is, an adventure."
691,111,So excited to have some Good dinner and chat time with Good ol friends
692,112,Sometimes it's easy to lose faith in people. And sometimes one small act of kindness is all it takes to give you hope again.....
693,112,It makes me so happy and proud to sit and listen to Brody read his books to me that I've been reading to him since he was a baby :)
694,112,Me and Stef sledding down the hill together = priceless
695,112,Wish the hubby and I could have a date night.. It's been waaaaay to long... But that would involve a babysitter and we don't have one... Guess we will be creative ;)
696,112,Making homemade cafe rio for dinner... Yummm :)
697,112,Our fun little mess we made on Sunday !!!
698,112,"It's not what we have in life, but who we have in our life that matters !!!"
699,112,Yah the drums they swing low and the trumpets they go ....... ????????
700,112,Hubby's taking our lil fam bam to buy a few new Christmas decorations and then were gonna spend the day decorating and getting all holly jolly !!
701,112,"Dinners done, kids are bathed and still an hour and a half until bedtime.. Guess we will snuggle on the couch and watch The Lorax..."
702,112,Went and watched my nephew in a skate comp.. And it seriously brought tears to my eyes how much he's grown up.. And btw he rocked it and took 3rd ;)
703,112,"Happiness doesn't come through selfishness, but through selflessness. Everything you do comes back around !!"
704,112,I take pride in being a good person !!! I do and say nice things to people cause I like to see them happy and smile !!! I choose to be around other positive people. I don't give anyone a reason to hate me.. They create their own little drama of pure jealousy ..
705,112,To damn close to home !!! Stupid lightning !! Hope they get it out fast !!!!
706,112,Today my Brody shocked me !!! He is growing up !! He had the choice of going to an Easter egg hunt or going to work with dad and shooting bb's after .. He chose to go with dad :) sure do love my lil man :)
707,112,"The happiest people don't have the best of everything
They just make the best of everything ??"
708,112,"I'm a little late, but thanks so much to all of my awesome friends and family that wished me Happy Birthday :) It was an awesome day and I was completely spoiled :)"
709,112,I don't know if it's in the air today.... But DANG DO my kids sure have their sassy pants on.... BEDTIME...
710,112,"What an awesome day we had celebrating my lil mans 7th birthday... We had a tie dye party, pizza, tie dyed shirts, and ate tie dyed cupcakes... Accompanied by the best of friends... Happy birthday Brody!!!"
711,115,Going to the cabin this weekend! first time this summer....cant wait(e)! hehe!
712,115,Today is gonna be a good day! Our new AC unit is FINALLY here and there going to install it this afternoon! maybe ill finally get some good sleep tonight!
713,115,Loved the thunder/lighting storm last night! I just wish the rain would have stuck around a little longer!
714,115,It either needs to rain or clear up.. im sick of the humidity and no rain and i DESPERATELY need to wash my car but cant because the sky keeps threatening me.....GURR!!!
715,115,No sleep last night is making for a EXTREAMLY long thrusday!
716,115,I hate summer! It brings all the tourists to town that cant drive!
717,115,I must say that I'm pretty good at multitasking...I can screw up several things at the same time!
718,115,Sick of stupid people and there ignorance!
719,115,Hates the fact that its flippin freezin here yet we get no perks of snow  :(
720,115,Please keep your eyes open for this bike.. people suck.
721,115,"It's as valid now as it was 8 years ago... these kiddos like to make me feel nauseous! Oh well, 6 more weeks till D-Day (delivery day that is!)"
722,117,Diggin the new 5FDP album fuckin sick
723,117,I think I just shit my pants
724,117,"Just when I feel everything is shit, one person always makes me feel it's worth it. Thanks Shayla"
725,117,Horse-shit and Hand-granades
726,117,I hate being sick
727,117,"Did you here the one about me givin a shit? Cause if I ever did, I don't remember it!"
728,117,Feel like hell today
729,117,Dead Island
730,117,"strangle strangle, laugh uncrontrollably."
731,117,my back is fucked. ouch.
732,117,"just got into a car wreck, FUCKIN OWW!!"
733,117,HOLY SHIT!!!! that take skill
734,117,I'm sick of everybodies negative posts all the time. From now on anytime someone has a negative post they will be automatically deleted.
735,117,Pop Quiz! Who is the biggest asshole you know?
736,117,THE EAGLES ARE THE SHIT
737,117,I'm.....dying........Squirtle
738,120,"i love my familise, i love my kids."
739,123,CARSON TOOK 5 STEPS!! YAY HE WILL BE EVEN MORE IN TO EVERYTHING!!
740,123,Happy Tax day everyone! Yay...I hopefully will be seeing more of my hubby now!!! (=
741,123,I can offically say that I feel like I have let myself go!! I hate feeling ugly!!!
742,123,So....I locked myself out of my house and had to break in the back door....Today has been an awesome day!!! NOT!!
743,123,Dang!! My baby boy is such a good baby!!! I love him lots!!
744,123,I have decided I don't want twins!! I watch my nephew a couple of days a week and Carson and him are a month apart!! I don't think I could do it 24/7!! It is tough work!!
745,123,Last night I was putting Carson to bed and I walked in his room to find him standing in his crib!! It scared me and made me laugh all at the same time!!
746,123,Oh my goodness!!! Has anyone ever made t-bone steaks in a crockpot? I made some tonight and the meat was falling off the bone!!! Soooooooo YUMMY!!!!
747,123,I make fluffy tutus if anyone is interested...I can make them to your specific color or themes too!! I have example pics on my photos!!
748,123,WE JUST FOUND OUT THAT JEFF PASSED HIS CPA EXAM!!! HOORAY!!!
749,123,I hate when my poor baby is sick!!! He sounds awful!!! Its hard being a mom.....especially when you are sick too!!!
750,123,Oh my....I feel amazing! CARSON SLEPT THRU THE NIGHT LAST NIGHT!!
751,123,I just gave Carson his first real haircut and he hated every minute of it!!!
752,123,YEAH!!! Carson just barely cut on of his teeth!! I just saw it this morning!!!
753,123,I am soooo sad Brittany Murphy died!!!
754,123,Forgot that I was cleaning my toilet and almost fell in. LOL wish I could have seen my face.
755,123,Isn't it amazing how you can make assumptions of people and find out you have some things in common! Yay for the remainder of decent people! :)
756,124,This dude ???? Good work dear
757,124,Jp s life. ??
758,124,Hey guys! I'm booking up this week and next for spray tans! Let me know if you wanna get bronzed before Christmas!
759,124,Life is too precious..
760,124,Thanks everyone for the birthday love! Me and Dev are both officially 24 today...yikes.
761,124,beautiful day in the neighborhood.
762,124,summer your a terd.
763,124,HAPPY BIRTHDAY JAESI! We love and miss you sugar.
764,124,HAAAAAPPPY BIRTHDAY JEN JEN ! YOUR DA BOMB JOO
765,124,feeling the pain of a good weekend at lake powell....very much worth it I think.
766,124,chillin with a yellow face thanks to my chemical peel/anti aging addictions.
767,124,thanks everyone. your all rad.
768,124,thanks peeps
769,124,HAPPY BIRTHDAY BRITTANIE! LOVE YOU
770,124,watching i love lucy drinking vanilla silk and playing with ollie poo....JAESI I NEED MAYA RIGHT NOW!...and dad does too. hes bad. hah
771,124,pants on the ground!
772,124,JULIE THOMAS'S BABY SHOWER DEC. 3OTH 6-8PM AT SANDBERGS HOME! MARK YOUR CALENDERS! EVERYONE COME! ITS A BOOOY!
773,125,"I try not to talk about this guy, especially on Facebook. BUT WHAT THE HELL!? How is this real life??"
774,125,Pizzzzza so much pizza.
775,125,Penny candies and this sweet man were a huge part of my childhood. My heart goes out to his family.
776,125,Visiting grandpa Biff
777,125,Happy thanksgiving everyone! ??
778,125,Happens to the best of us.
779,125,All the world is mad. ??
780,125,"We're leaving for California/Disneyland this week. (Surprise to Koen) any tips or tricks to doing Disney with a toddler and a big kid would be greatly appreciated, thanks!"
781,125,So... really though can I have yo numba? can I have it?
782,125,To cut all my hairs off or not to. That is the question!
783,125,"I'm thinking of taking Rad up to Zion for a little hike. If any of you other momma's or non momma's wanna join, let me know!"
784,125,Does anyone know a good seamstress that could alter a dress for me? Preferably today?
785,125,"Sheesh! Ya'll know how to make a girl feel special. Thanks everyone for your messages, texts, gifts, hugs, cards, and posts! Love you all!"
786,125,Koen: Jesus put a spell on me to be handsome.
