,0,1
242,33,I am going to be needing a new babysitter in the somewhat near future.... It's pretty much part time... So if anyone knows anyone awesome who could handle Miss Tavia let me know please... Thank you!
243,33,Tavia says " I want to go to Erindale to visit my sisters" okaayy I'll get right on that! Haha
244,33,Love my Gramps!
245,33,My bffs Vegas wedding
246,33,Listening to Destinys Child reminiscing on my teenage years with my BFF... Who got married last night! It's so crazy how old were getting!!! Congrats BjandAsh Pugh... I am so happy for you two!! Love you guys! 
247,33,"I have heard all the excuses in the world why Tavia can't go to sleep tonight... Her ear hurts, her hairs in her face, she's to grumpy, she's hungry, she's thirsty, I'm to mean, she will be to itchy if she lays down, she's cold... Haha what will she think of next?"
248,33,The Tim McGraw & Faith Hill concert was so amazing!! I love them! Tim gave away his guitar to a 10 year old kid in the audience it was so sweet... And we also got lucky and got great seats..
249,33,Does anyone know anywhere that's hiring? :)
250,33,I hate car problems!!!!
251,33,LOVE IT!! Words to live by!!
252,33,I love this! You really never know what people are going through in their life... We should all try and be a little more gentle!
253,34,I don't think I'm that old yet...
254,34,Bad chicken!??
255,34,??that sounds about right ??
256,34,See kids this is why we don't do drugs...
257,34,Really? Has it gotten that bad?
258,38,Love these cute kids!
259,38,I have all this stuff. We would just need a muffin and bright pink frosting and plus I did some with pink balloons on a chair
260,38,She sure looks like her mother!!
261,39,I won the SINGLE BALL CUP on Real Basketball !
262,40,Sign up for dollar shave club I love these razors and I love getting them in the mail as often as I want!
263,40,Cute little girl
264,40,This is awesome
265,40,Something the new guy gets designated to do
266,40,Boom just won these for tonight
267,40,This too funny haha a mans just gotta know when to walk away haha
268,40,You know you had a long day when you are watching some stuff in bed with you kid and all of the sudden your wife is waking you up telling you to get out of his bed!
269,40,K 49ers just need to forfeit or something this regular season win is not worth all of these injuries!
270,40,"There is a internal struggle that occurs every time I step foot into a movie theater! Will I be able to hold my pee until the end of the movie or not? I am proud to say I conquered this battle during Thor and it was worth every moment of pain, uncertainty, and nervousness!"
271,40,So true screw them till at least march!
272,40,how about them niners baby? freaking awesome how awesome would it be if they beat the lions next week
273,40,suu was on espn's top ten plays this morning! ...... it wasn't really for them though it was for south dakots great catch against them..... but still!
274,40,hahaha wear it yankee fans! I dont even care that neither of my teams made it! bottom line is it's a good year when the yanks lose!
275,40,hey remember that time that my two favorite teams in baseball are the red sox and braves.......enough said hoping and praying that tomorow works out for both of them!
276,40,hahaha take that tom brady not so record breaking today are ya hahaha! ps did you see calvin johnsons catch holy cow! I love football!
277,40,by the way that lightning storm last night was insane! it was by far the most lightning I have seen in my life it signed like it went off every ten sessions for four hours!
278,40,I swear if the braves choke and dont make the playoffs I'm going to freak
279,40,this weekend while playing softball I sat on a fence...... I also broke that fence and fell into stickers!
280,40,wow that ump was terrible on both sides for the sox yanks game today
281,40,oh football how I have missed you
282,40,"while laying on the floor with my don just now, he is sitting on my chest playing, he then leans forward and pukes into my mouth! blah that was gross!"
283,42,Till death do us part.
284,42,"He's got that look in his eye , ""what can do to piss Bryan off today """
285,45,happy spring!??
286,45,Looking forward to thanksgiving! :-)
287,45,I sure love my three little bears haha boys ;)
288,45,throwback from when jerrin was little :-)
289,45,Happy Sunday! :-) and Memorial day weekend!
290,47," agree, if things like that don't work like they 'claim', than people wouldn't have been using them for hundreds of years. I just skimmed through that part and didn't put a lot of stock in it. I found it more entertaining than educational."
291,49, Cute lil fam¦?¦?¦?
292,49,So i got my palm read this weekend. according to my palm im very passionate i get hurt easy im going to have a strong healthy life im ganna have lots of money and im ganna have 2 kids:)
293,49,:) im excited for the future
294,50,Having a blast at the 4 wides
295,50,Smoked or deep fried? Yes please
296,50,"This is pretty awesome, I hope you enjoy it as much as I did"
297,50,A local seal came to say hi whole we were snorkeling
298,50,Snorkeling with some giant sea turtles in the Galapagos
299,50,"Although I'm a little sad to see the separation, I can't say that I'm surprised."
300,50,It's boating weather!
301,50,Spoiled dog
302,50,The backyard is smelling pretty delicious!
303,50,Having a good time at the monster truck show
304,50,"Atlas gets a bath then Kevin and Jandee walk into the bathroom. Atlas runs to me and says, ""Jandee is giving Kevin a bath too!'"
305,51,My girlfriend Kristin Swain spoils me. Best Christmas present ever! 
306,51,Please pray for the Stapley family. Family friend and neighbors just 2 houses from us. Father to 6 girls and a wife. Please be safe and wear a beacon as it may save your life or those that get caught.
307,51,Anyone have any information on this plane crash? I can t find any info anywhere. Looks like someone collected all the belongings and pieces of the plane. Guessing it happened within the last few days. It s on Guardsman Pass in between Park City and Deer Valley Resorts.
308,51,Lost a Legend but his Legacy will live on!
309,51,Some people say you re not allowed to hang off the cruise ship. I beg to differ
310,51,Ever felt like you had a rough day? It can t be as bad as this little guy
311,51,Love doing service with a good crew
312,51,Just happened in Utah. So glad they had a Vivint Doorbell Camera to capture what happened. Love being able to help secure families with security and cameras ??
313,51,Use the left lane for passing not going slow. Germany does a great job of this. Must watch.
314,51,Happy Birthday to my little brother Kenneth Stocks! Proud of him flying out to Maryland yesterday to start his internship!
315,51,Thanks to everyone that wished me a Happy Birthday! ??
316,51,Happy Mother s Day to the wonderful Mother s that are in my life! All 4 Mother s here are so caring and kind. They do so much! Love you all and Happy Mother s Day to all the Mothers out there!
317,51,If you have met my Dad I know he s made you laugh and smile. He s so caring and always putting others first. He s taught me a great deal of hard work and getting things done when they need to be. So grateful to call him my Dad ?? Have a Happy Birthday today! Love you! ????????
318,51,Yesterday was Mothers Day and I want to wish My Mom Alyson Stocks a Happy late Mother's Day for how wonderful she is and the other wonderful mothers in my life. Also a Happy Birthday to Jennika Smith and my Grandma Joyce Madsen today with the same birthday!!
319,51,"Today is my Dad's Brian Stocks Birthday! He has taught me a lot in life about hard work, being serious, making goals, how to laugh and make me smile. I still can't tell jokes like he can. He loves plays and grew a beard and then shaved it to play Colonel Buffalo Bill in Annie Get Your Gun down at Brigham's Playhouse. If you haven't seen it, go do so it's amazing. Love this old guy ?? Happy Birthday!! ??????????"
320,51,"Happy Birthday to my amazing Mother Alyson Stocks . She's not only kind, caring and loving but she's the fun Mom that likes to go hiking, skiing and try new things. Love ya Mom!"
321,52,This girl did such an awesome job at her cheer competition. So proud of her! ?????+?
322,52,"My sister @mir.i.am7 sent me this pic today of my nephew @peytonholmes24 basketball shoes. Peyton is like my little brother and I remember watching him play on a basketball team when he was 5 and making his first basket. Miriam and I looked at each other and started crying. ??????Never have I seen anyone work so hard towards something and be so focused. He is someone I admired and love dearly along with the other Holmes kids @lincoln.holmes and @presley100holmes. The video is from a couple weeks ago. Double over time, tied game with 2 seconds left. He is a sophomore playing on varsity. ?????? "
323,52,Baby girl is 3!!! ????????
324,52,This girl thinks she s so sneaky! She did this over and over and then would run to me and take a selfie. I love her! 
325,52,It s been WAY too long since I ve taken a class or even danced! It felt so good to dance and be with my main girls!
326,52,This girl kills me! She s getting so big! Can t believe she s all mine! 
327,52,Had the best birthday with some of my fav people! 29 is gonna be a great year! 
328,52,In honor of everyone else starting school today we will just keep pretending for a little longer. Those glasses tho! ????
329,52,My lil mini me. ??????Even though she looks just like dad she wants to be just like mom!
330,52,"Happy Fathers Day to this amazing guy! I can t believe how lucky Tru and I are to have such an amazing, funny, hard working, loving and supportive dad/husband! I love you Nolan! Happy Fathers Day! ??????"
331,52,It was this special guys birthday yesterday so of course we celebrated by going to the Backstreet Boys concert! I love this man so much! He is the best husband and an even better dad!!! Happy Birthday Nolan! Tru and I Love you!
332,52,We had a great Christmas with my family! Tru loves being with her cousins(especially Lincoln) and seeing her favorite aunts and uncles. And of course Nana and grandpa! Last year it was just the three of us in Houston by ourselves which wasn t horrible by any means but it definitely is nice to be close to family again!
333,52,Happy 1 year Anniversary to my amazing husband Who Spoils me rotten! I Love you Nolan Boyd:) Have a safe trip to illinois for two weeks. I'll be missing you like crazy! Love you!
334,53,Always fun to wake up to see Ty destroy his own bed!
335,53,Headed back home to MIA! Nice little weekend vaca with fam was awesome!
336,53,There's more snow and colder in utah in april than it was in december!
337,53,Time to shake things up!
338,53,Fresh snow!
339,53,Spending some quality time with loved ones!
340,53,Wow! Just when you think things are going good life throws a curve ball at you!
341,53,Life is too precious to sweat the small things. Take one day at a time.
342,53,Thank you everyone for the birthday wishes! Appreciated it very much!
343,53,"It hurts me deeply to say Lilly, my best friend and companion dog, tragically passed away last night from bloat. She will always be in my heart forever!"
344,54,this kinda reminds me of stories from your code 10s.
345,54,This is currently me
346,54,Loving it! I get to enjoy summer too. My last day at my 2nd job is the 24th. Bring on that summer fun!
347,54,Why I had to leave
348,54,Well next step has been taken. It's been since summer and my eczema flare up still won't go away. Got a referral from my doctor. Let's hope the next doc can help me. It's been so frustrating. I wanna be ready for bikini season.
349,54,Every time I see this it breaks my heart. I wish people were as protecting of those they are close to.
350,54,I look the same haha. Well minus the lip ring.
351,54,Is it Friday try? Ready for ink therapy.
352,54,Thinking about something along the lines of this as my next tattoo. Artistically done beauty and the beast rose. But I need ideas of placement. Anyone?
353,54,The last few months have sucked ass. It sure would be nice if it would stop going bad just when starts going so well.
354,54,This Lil one keeps me together. If only people could just truly love unconditionally. Be there for you every time you need it and stop disappointing and letting me down. I'm so thankful to have her. Best love ever is from that of a pet. This one is amazing and I couldn't imagine my life without her.
355,54,I had way too much excitement this morning! Enough close calls my family and friends. I love you and be safe.
356,54,Definitely not going in early with no plows out! I hope I'll be able to make it work tomorrow morning.
357,54,We'll see if I can even make it outta the parking lot. Yet alone making it to work.
358,54,I believe this is the first white Christmas I've ever had. Yet it sucks cause I don't get to wake to anyone one to celebrate it. Yeah this yr blows worst then last yr.
359,54,Waking up with uncontrollable pain in my side. Ugh. I might be going in the doctors to make sure it's not serious. Happy Christmas to me. I was having such good luck with at least not getting sick.
360,56,"Evie is one year old! And predictably, as the second child, she got a piece of cake two days after her birthday...and nothing else from us so far. "
361,56,"Wow. Just finished reading The Handmaid's Tale. Dang, Margaret Atwood. Don't know why I never read it before, but I think it probably was a lot more affecting now that I am a mother. Also, her dystopian society seems frighteningly plausible to me, especially compared to all the dystopian literature that's popular these days."
362,56,"I'm glad that in real life we've been friends and sisters for 30 years, and probably even before that. Love you, Rae."
363,56,"I'm a newlywed, so I get to post stuff like this every once in a while :)"
364,58,"i love my familise, i love my kids."
365,60,free ipad!!!!!
366,60,i love old ladies with nose piercings. they keeps it real.
367,60,thinks that working graveyard sucks!!!!!!!!
368,60," Life is full of beauty. Notice it. Notice the bumble bee, the small child, and the smiling faces. Smell the rain, and feel the wind. Live your life to the fullest potential, and fight for your dreams.  ¦"
369,60,i need new music! what are people listening to these days?
370,60,happy birthday Jesus!!! thanx for the socks.
371,60,Is carving pumpkins.
372,60,has a job!!!
373,60,"i feel good, i feel great, feel wonderful, i feel good, i feel great i feel wonderful"
374,60,fuck you american express...fuck you
375,60,im so ronery. so ronery and sad.... im real ronery
376,60,7:00 in the morning and i just got off from work. god i hate my life
377,60,jalapeno cheetos are bomb!!!!!!!
378,60,skyler campbell + alcohol = disaster no worries man it happens to everyone.
379,62,"This is a great message! I love the presentation. If you haven't heard of ydraw you need to watch some of their videos, what a neat idea!"
380,62,I love this speech!
381,62,"What do all these things have in common? 
Yup i am having a GIRL!!!! i am so excited!"
382,62,Thanks so much to everyone who wished my a happy birthday!! It really made my day!!
383,62,Baby #3 on the way!!
384,63,Smiles for daddy!!!
385,63,Who's this cool guy?
386,63,Look at that freaking face!!!!!!!!
387,63,Tiny foots
388,63,Best day of my life right now.... My little girl is sleeping on my chest. Having a great day!
389,63,Left eye is gettin red... Better put my pj's on.
390,63,Love this truck.
391,63,Can't wait to go wheelin again...... :'(
392,63,"Got my guitar rig set up at home. Could really use a pick. Had the guitar since 2002, and it still looks great."
393,63,"Just wanted to thank all my family and friends in utah for all the help and fun I had last week. Thanks for the use of your homes, and for clocking in some quality time. Special thanks to Devin Brandt for making my yota run great and get me there and back safe every time. Those of you I didn't get to see... I'm sorry about that. I had a very full plate. I'll do better next time."
394,63,Can't sleep..... 6 more days until I leave Moses hole to visit home!
395,63,In need of some kind of change. Tired of the daily grind.
396,63,"Went to the store with whit, and now watching AMA supercross. Good weekend so far."
397,63,Pregnant whit
398,63,Flexin the ol yota. Sadly there are no good rocks to flex out on in this forsaken desert. But I will be in God's blessed desert in 5 weeks or so. Get ready St. George.
399,63,Busy busy busy. Lots on my mind right now... and I just found a razor blade or something massive in whits car tire. I thought it was a rock or something cuz I could hear it from inside the car as I drove.... Ya... Massive. Discount tire to the rescue soon.
400,63,Hates going to the doctor...
401,63,Got my retro 80's Toyota wheels on. Painted em myself. Couldn't be happier how they turned out. Little projects are awesome.
402,63,Dear utah..... I WANNA COME HOME!!!!!!!!!!!!!
403,63,Had a good day off with my wife. Ready for her birthday tomorrow.
404,64,This woman is my rock.. without her there is no meaning. I love you Wendy Rangel. Thank you for motivating me daily to be a better man. I am eternally yours. <3
405,64,So this just happened...! Btw..she said yes! I became the luckiest man alive the day they found me!! I love you Wendy Rangel! I am yours para siempre!!
406,64,Love it!
407,64,Please help if you can. We keep losing people. Let's help those who still have a chance!
408,64,If you could comprehend the level of skill and control....
409,64,Alex Stout is the best mechanic I know.
410,64,Another fun pool day with the kiddos! RIP to the flaming hot dogs. Good thing we had backups.
411,64,Manuel Pensamiento. Seriously! We couldn't even pick up the trash before snapping a shot?! Love and miss you brother.
412,64,Go tag your friends and share!!
413,64,All month. Thanks Alexis Hoskins for the inspiration. Ill set one aside for you to make you come see us.
414,64,Vote now! She is brilliant!!
415,64, i would take the Acai bowl although the green smoothie is very very good!
416,64,Love our espresso!
417,64,Just started reading Amory Wars. Never read a comic or graphic novel in my life. As a huge Coheed fanatic...mind blowing!
418,65,"i love my familise, i love my kids."
419,66,"The Big Cottonwood Marathon & Half is proud to announce that Julie Holm ran the 2013 Marathon on September 14, 2013. Go Big!"
420,66,he is he misses his jasy wasy... question... steve and jaime made the mose incredibly amazingly child of god... maybe we would too..??.. just a thought...
421,66, shes milk drunk
422,66,i know the only word he got right! ha ha i love him!!
423,66,the yittle duck story
424,66,Love!
425,67,Happy Birthday to the number 1 mama in the world. Love You!
426,67,New co pilot in the semi. Sun was in his eyes
427,67,Happy Birthday to this beautiful mama Larissa Jones. I love you! You are everything we need and more! Thanks for being the best Wife and mom in the world. ????????
428,67,Happy early anniversary to us!
429,67,This is where we are from. Love the valley. Especially this time a year!
430,67,This boy is growing up. Getting ready for family date night!
431,67,Baby face
432,67,Happy birthday to my daughter Ambria Jean Jones. Where has 8 years gone. She is so full of life and love and energy. I love you baby girl!
433,67,Ambria Jean wants to earn some spending money for our trip to lagoon. I think I'll hire her.
434,67,Im going to take the high road and not talk smack on the haters who told me no way!! . . . . . . . . NOT I told y'all LeBron goes to the Lakers. . man I can't even remember all the Bets I have to collect on.
435,67,"Happy mothers day to this beautiful mamma Larissa Jones she is the glue that keeps our crazy, loud, energetic family together! We love you"
436,67,I might have been wrong wanting to play the Jets over the Preds The way they're playing tonight. We're ready
437,67,Love having my co pilot on trips in the semi
438,67,Happy Birthday to this lovely lady. Larissa Jones I'm so proud to call her mine! She is the perfect mother an amazing wife and my best friend. I love you
439,67,So proud of this little lady. Took first place In the storytelling contest!!!
440,67,Happy Birthday to my old man Richard Jones so grateful for everything he does for our family and for our relationship love you pop.
441,69,Hearing the backlash about Sonic.
442,69,I love going out to eat and ending up next to the loudest douche trying to talk himself up to a girl who he barely lets talk.
443,69,Happy Star Wars day.
444,69,I need it to be the 7th of next month so we can be on that cruise ship! 
445,69,"I'm a simple man. I see Disneyland posts, I hit like."
446,69,So many frustrating points but still a good episode.
447,69,Everybody's going to die today!!!
448,69,"Humping the furniture
Burgling turds
Killing chickens"
449,69,Chae and I took the side by side for a little run down Warner Valley and I can't remember the last time I was so covered in dirt.
450,69,I hate April fools.
451,69,There is no diversity because we're all burning in the melting pot.
452,69,Get on the offensive and off the defensive.
453,69,We picked up my prescriptions and topped off the gas and we're on our way!
454,69,And now the clock in my truck says the right time again. I knew I just had to wait it out.
455,69,We got a new neighbor across from us and one of them is the tallest dude I think I've seen in person. He has to duck to get in the door.
456,69,"Meridith, you've slept with so many men you're starting to look like one. Boom! Roasted!"
457,69,That was a nuts game. NUTS!
458,69,"I have a nice comforter, a few cozy pillows, I usually read a chapter of a book, and it's lights out by 8:30, and *that's* how I sleep at night."
459,71,Finished installing this fun park for my client and now good friend. Here are few pictures of my endeavors.
460,71,I'm ready for the warm. Toronto is too cold for me.
461,71,"Time doth softly, sweetly glide...."
462,71,"This boy is one of my ""Why's."" I love the fact that my family gets to enjoy what I do for a living. On another note, Tyler has a pure look of satisfaction after conquering one of our wall panels."
463,71,Happy Valentine's Day to my better half. She is always there for me and supports all of my crazy ideas. I love you Rochelle.
464,71,Here is a video of the trampoline basketball lanes I installed in Wilmington Delaware. Everything turned out nicely.
465,71,"Reading ""The Compound Effect"" by Darren Hardy.

If you want success in your life, what better way than to learn from people who are successful. Make time for your own personal development my friends."
466,71,How do you start your day off? So much better than soda. Ask me how to get some free samples.
467,71,"End of month today! Great promotions and freebies today only! If you are ready to take charge of your health, let's do it together!"
468,71,"If you do tomorrow what you did today..... Would you get what you want? Don't be afraid to dream and make it happen. Sometimes for things to change for you, you need to change what you are doing."
469,71,Putting in a Herbalife order tonight. Let me know if you would like to get on a program or want some tea or some liftoff.
470,71,"If you want to be successful, you surround yourself with successful and positive people. Had an amazing call last night with millionaires while others were watching TV."
471,71,"""If it's to be, it's up to ME!"" Exactly what I needed tonight. Massive action, massive results! The Alex momentum train in on the move. Time to jump on to better your lives."
472,71,Heading over to a hip hop dance session if anyone is interested. It's free and a good way to burn the energy out of oneself or little ones.
473,71,Had a great time this afternoon hanging out with some stellar people!!!
474,71,"Who wants to go on a very short hike tomorrow evening to see some petroglyph panels up by ""The Ledges""? It is not a very strenuous hike, so it's good for all ages. Come and get some fresh air."
475,71,"I have the vision. I know what I want, and I'm going after it."
476,71,Energy level at maximum! Thank you NRG tea and Orange LiftOff. BEST DAY EVER!
477,72,A horse is not a home.
478,72,And I'm not happy and I'm not sad you did a bad thing.
479,72,Be jealous
480,72,I know what I'm good for.
481,72,Where's all the hot gamer chicks?
482,72,Love you more than you know.
483,72,Loooooove being lied to...
484,72,Love being ignored.
485,72,Need a friend right now:(
486,72,who the hell are you?? delete
487,72,Worse sleep ever.
488,72,"boo boo bee boo I'm a naked cowboy, wanna see me bum bum.... bum bum?"
489,72,"I'm up in the woods, I'm down on my mind."
490,72,Killin me softly
491,72,Sad day:( someone cheer me up.
492,72,Wind can suck it.
493,72,My fingers hurt
494,72,I farted.
495,72,I jus want my mind to forget everything and start over.
496,73,Right?! Me too!!!
497,73, I wish though! It's an old photo. Just reminiscing about tripping together. ??
498,74,I just wanna stay in bed!!! ????
499,74,When the radio is playing  sunny and 75  but this is my view and we are expecting at least 2 more inches today.. ??????
500,74,Happy Valentines Day!! ????
501,74,"I must say, I have some pretty awesome friends!! ??Thank y all for everything!! Had a great Birthday!.. donuts, kid-free car shopping, new car (thanks babe, I love it!), yummy dinner and cake!"
502,74,Not the best pictures.. but Hannah had so much fun at her first dance class. Thanks Kristie for putting together another great event!
503,74,Hannahs lovin bein a cowgirl! Thanks Nana and Papa.
