,0,1
0,2,Naturally she had to test the dog beds out before we picked one for the pups.
1,2,This piece of art I call  The Sitting She . (Working title)
2,2,She s a tad adventurous and stubborn and cute and strong and fun! I think we ll keep her! 
3,2,"My two Valentine s!!! I am smitten . . . I am in deep smit! Chalk this up to another FANTASTIC Valentine s day! Spent time together just jammin out to music, watching a movie, eatin food, doin a little work, just doin the things we do best, bein together!  Living our best life  (as the kids say) together mostly means we re enjoying each other s company so much that we forget to take pictures and document fun times, but we did happen to snag a few pictures of our Valentine s snow trip earlier this week! I love you @bekhanley and little Tru. You both are the most!"
4,2,I just want to say thanks to the fantastic friends who wished me Happy Birthday! I love you all! I am blessed beyond measure! And thanks to Rebekah for making my birthday fun and fresh! Love you Beky! You re my best. Friend! ??
5,2,"to when I kinda looked like Tom DeLonge from old blink-182, Unofficial: Boxcar Racer, Angels and Airwaves , etc. Also my fierce #Samurai skills (bathrobe sold separately), my future mug shot, and some #braids going on. Kinda missing it."
6,2,I love this little human!
7,2,FOR THE LADIES: This is Beky. She s amazing at what she does. Truly an artist! Why get your brows done by her? To save time on the routine and have perfect brows like all the time. Brows By Beky Microblading is where functional meets flawless. Contact her for a free consultation.
8,2,It was a good win last night for us! Excited for some free Krispy Kreme  s today for the shut-out (5-zip). Had my  ride or die  chick by my side the whole night! ?? Love you 
9,2,Devastating! 
10,2,"Paradise, CA. This is my cousin and his family. Say some prayers for those who are not so fortunate right now."
11,2,Mommy wow! I m a big kid now. 
12,2,Little Minnie Mouse. She had fun ... for about 30 minutes. Not bad for an almost-3 yr. old. @bekhanley did a great job with her costume! Halloween rocks! 
13,2,"My little minion at the  Trunk or Treat  last night. We missed Mom-mom in Colorado. Luckily she ll be back today. Tru went down the big slide and got a ton of candy. #halloweenrocks #happyhalloween #truluna @ Las Vegas, Nevada"
14,2,My thoughts exactly!
15,2,"Please share! You could change these lives forever. They are my great friends, and will be truly the best parents!"
16,2,"I tried to get my new (702) phone number out to everyone. If you need it though, send me a direct message. And sorry to those a part of group text messages I sent. I hate those, but I couldn t find a good way to let people know individually. 
Hope you have a great day! ??????"
17,2,"Beky shared this and I thought it pretty much embodied who we are as a couple, as a team, and as lovebirds. She and I love to do everything together and pretty much never be apart. A lot of people think we re crazy, and they are probably right, but all I know is I am lucky to have a best friend like her where I WANT to do everything with her every day. She s always got my back, always lifts me up, and is truthfully my inspiration in music, in goals, in life! I didn t post anything yesterday because we were having too much fun to waste time posting. Haha I love her forever! Happy 8 years Rebekah! Now enjoy her voice and this song. ????"
18,2,"My songs are my journal entries, so this is just one of those meaningful chapters in my life that I m sharing with you. I appreciate every good and bad, and great and terrible experience that made me who I am. In my life, it s never win or lose, it s just win or learn. Be grateful that you have the ability to  love and be loved in return!  Love you guys! Thanks for listening!"
19,2,"My great friends run these Las Vegas locations of Jimmy John s and are looking to fill management positions. If you have management experience or Jimmy John s experience, or just a great attitude and the will to learn, let me know and I ll set up an interview for you."
20,3,#teamstewvlogs is creating playlists of some of our favorite adventure vlog ideas and challenges.
21,3,You ve heard of Dude Perfect. Well is is Dad Perfect.
22,3,I want to redo this with Dry Ice on a long board and see if I can surf down
23,3,I think I won this round.
24,3,This was silly but a fun one. We played crack the egg on the tramp with a real egg. Tel lost.
25,3,Yes... we did this.
26,3,Yes... we did this.
27,3,"Tel got showered in mustard. Crushing Crunchy & Soft Things by Car! - Lego, Squishy, Takis and More!"
28,3,Happy Birthday Grandma
29,3,This was interesting. Watch the whole thing on our #teamstew YouTube channel
30,3,Woohoo another video is up!
31,3,Woohoo another video is up!
32,3,This was really fun. I want to do this again!
33,3,The kids programmed the robot to play jingle bells. Come check out our fundraiser at Barnes & Noble in St. George.
34,3,"3 And not only so, but we glory in tribulations also: knowing that tribulation worketh patience;

4 And patience, experience; and experience, hope:

5 And hope maketh not ashamed; because the love of God is shed abroad in our hearts by the Holy Ghost which is given unto us."
35,3,"To the proud, the applause of the world rings in their ears; to the humble, the applause of heaven warms their hearts. "
36,3,"42 Behold, he who has repented of his sins, the same is forgiven, and I, the Lord, remember them no more."
37,3,"in fact, in a resurrected, otherwise perfected body, our Lord of this sacrament table has chosen to retain for the benefit of his disciples the wounds in his hands and his feet and his side--signs, if you will, that painful things happen even to the pure and perfect. Signs, if you will, that pain in this world is not evidence that God doesn t love you. It is the wounded Christ who is the captain of our soul--he who yet bears the scars of sacrifice, the lesions of love and humility and forgiveness."
38,3,"We could remember that Jesus found special joy and happiness in children and said all of us should be more like them--guileless and pure, quick to laugh and to love and to forgive, slow to remember any offense."
39,3,"It is I will resolve that the leadership of my family will be my most important and sacred responsibility; and I will not leave the teaching and governance of my family to society, to the school, or to the Church."
40,3,Okay so it didn't air today... but we are told sometime this week! I'm excited!
41,4,10/10 - would highly recommend Wedding Swig as well as being married to this girl
42,4,"Why are there no knock knock jokes about America? Because freedom rings.

Happy 4th of July everyone!"
43,4,I've decided to fight social norms. Along with shaving my beard in protest of no shave november I will also no longer be wearing a bra to support my hippie girlfriend.
44,4,"Attention Friends: Katie and I are having the 1st annual BOSScathlon, a 6 event test of skill in order to determine who is the boss in our relationship. We need your help to suggest a final event. We also need two special guest judges to help determine the winner. Any volunteers? Ready go!"
45,4,I got to see my old friend Ashley Louise Johnson today! Makes me miss all the good times with my Provo buddies.
46,4,Hey Guys! So the team and I just came up with some new potential product ideas. Take this quick survey and lets us know what you think of them!
47,4,So much Star Wars .............
48,4,Painting the street!
49,4,Curse you pants! You have failed me for the last time!
50,4,Amanda wright is my favorite!!!
51,4,lost my phone amid the intensity of the mancathalon. so facebook me if you need to get ahold of me.
52,4,AMERICA!!
53,4,Amanda Wright is my favorite person!:)
54,4,Chilling in St.George and watching zombie movies with my brothers. Life is good
55,4,Thanks to everyone for all the birthday wishes. You guys are the best!
56,4,Needs a good scary movie for tonight. Any suggestions?
57,4,Is the truth.
58,4,My name is Austin and I am hot
59,4,Should I watch the first season of heroes or the second season of 24?
60,4,My facebook just got hijacked. :(
61,4,Is sick over finals week. Real cool immune system .... real cool
62,5,So it keeps rotating the picture when I save it so I'm trying to get it to stay straight. Lol
63,5,I really need a break from all the politics so here's a fun dance number from one of my favorite movies. I'd love to see your favorite dancer numbers from old movies.
64,5,This is really worth the read!
65,5,I need more people to answer these 4 quick questions please. It doesn't take long and you can be anonymous. I am doing a research paper for my English class and this is the last week I have before I absolutely need the results. Thanks to those who have helped me so far. I greatly appreciate it!
66,5,A few more from this beautiful couples wedding! Follow K Styles Photography for more.
67,5,This is my punishment for waiting til the last minute to finish this week's homework. My computer is running super slow and my wi-fi doesn't want to connect to the network. Ugh...
68,5,Maybe eating almost a whole thing of hummus wasn't a good idea.... 
69,5,I'm doing this poll for a research paper for my English class. Please help me out by answering just 4 questions. It won't take long and you can be anonymous.
70,5,Took me a little bit to get this posted. Logan partially got himself dressed the day we did these and it altogether just turned out so cute!!
71,5,OH I am so buying this!!!!! I love them both and it'll be so good!!!!
72,5,I may try this recipe.... I don't really love peanut butter cookies but this is so easy and quick it may be what this pregnant lady needs
73,6,40 (ish) weeks
74,6,Created with celebratepride
75,6,HA! The Examiner says I was right.
76,6,"Guys, next Monday is my BIRTHDAY! And I want you all to come celebrate with me at this fundraiser event at Dickey's BBQ. Please come so I can see you, hug you, and take your money to feed families in need in our community!"
77,6,"Hahaha! Ah, kids."
78,6,"This made me cry and feel ill. I've been among these kids with ""behavioral problems"" and this is NOT the way to deal with them. I understand that the child and the children around him must be kept safe, but some of these tactics are downright terrifying. 
Alex & Sariah, what do you think?"
79,6,Spendlove Studios is AMAZING!!
80,6,Sometimes our dog is a rabbit.
81,6,Elbow dimples make me melt.
82,6,Go and like Wood Creations and enter the giveaway! I love this place!
83,6,"This is a worthy cause that hits too close to home for most of us. Please share and donate, if you can."
84,6,Friends looking for work in St. George: Chase bank is hiring a teller for 30 hours per week - includes benefits and paid vacation. Message me and I'll give you the info (and put a good word in for you with the manager!)
85,6,My laptop fits perfectly in the diaper bag. This work-from-home gig was meant to be.
86,6,"Guys, Piccolo Mondo has hands-down the best Italian food I've ever had. And Chef Alfredo kissed my hand tonight and I must have a little crush on him because I blushed and giggled like a little girl."
87,6,Come check out Tuacahn High School's Renaissance Feast this weekend. I am really looking forward to it - we had a blast last year. We are going on Thursday night if anyone wants to come with us.
88,6,"This is a super fun event at Tuacahn, happening this week. We went last year and can't wait to go again."
89,6,Where is the best place in St. George to buy fresh seafood?
90,6,Hehehe! This silly song makes me happy.
91,6,"Second tooth came through without a fuss... I'm planning on the rest of teething, potty training and adolescence to be this easy as well."
92,6,"Those of you who know me well may be shocked by this, but this weekend I purchased a pair of skinny jeans. And I love them."
93,6,"Guys, yesterday my baby rolled over, cut his first tooth and slept for 7 hours straight. He says tomorrow he wants to take the car on his date."
94,11,It was a great birthday today! Thanks everyone for all the birthday wishes. And thanks to my wonderful wife who went out of her way to spoil me today! I love ya babe!
95,11,Vegas here I come!
96,11,I love it when I get a bunch of texts all at once that were sent yesterday . . .
97,11,It's better to have hope in your soul than soap in your hole! lol
98,11,Just got done doing Yoga for my first time. It was intense!
99,11,So excited for Blue Man Group tonight!
100,11,My most recent photo
101,11,Just passed my faa instrument rating knowledge test!!!
102,11,So sick of studying!!!
103,11,I logged 11 hours of flight time yesterday!!!
104,11,Thanks for all the birthday wishes! You guys are awesome.
105,11,I Love Disneyland!!!
106,11,GOAAAAAAAAAAAAALLLLLLL!
107,11,hates when it's too windy to go fly :(
108,11,Flying my new plane home this weekend! Yay!
109,12,I vote a girls night to a NKOTB concert! Who s in!?
110,12,Oh my gosh this is me right now...
111,12,"I mean, the nerve of some people ??"
112,12,This app is unique. It lets you write directly on your camera!
113,12,Love this. It's a great story of keeping Christ and Santa in Christmas together.
114,12,"This is awesome, what an amazing experience and way to show the people of the this world what missionary work is all about."
115,12,It's not a privilege it's a right!
116,12,"Watching the Bachelor every time Sean is kissing one of the girls Cooper just says ""Ewww, that's soo gross..."" Haha. He's right though."
117,12,I wanna keep this for future reference.
118,12,Is anyone else grossed out by the go daddy commercial? Sick nast!!!!
119,12,Personal experience!
120,12,"Just wanted to apologize to my Pinterest followers, I was organizing my boards. So sorry for the multiple pins :)"
121,12,Well I guess I don't have respect for all these people who passed. I HATE these stupid like pictures...
122,12,I miss so many of these things
123,12,What!!!! Yes!!!! I'm so happy to live here
124,12,Just no... Super annoying
125,12,Just in case the wheelchair picture wasn't motivating enough. Geez Louis!
126,12,Look at all those guns.
127,12,So with Obama's Inauguration Day coming up should all of the security he have not have guns?
128,12,Any of you that live in the snow. I wouldn't have thought of this when I was up there
129,12,It's been a magical day! Merry Christmas everyone!! Love my family and friends and my Heavenly Father! So many things to be grateful for!
130,13,I can't wait to make this pretty little lady my wife! I love you!
131,13,I love this girl she is my whole world
132,13,Anyone in mesquite down to hangout!? Where's everyone at?
133,13,See I told you that you do this here is the proof Ashley Gronowski ;)
134,13,"I am definitely missing my girl right now And I gotta go another work week w/out her, this sucks ballskis"
135,13,Damn strait! Too many cry babies blaming their problems on other ppl. Time to do something with your life's that you can take credit for
136,13,Guess I should just keep my mouth shut like usually
137,13,I know someone would love to have calis last pup! need to find him a good home :)
138,13,Iam me I'll always be this way. Sorry I'm not up to everybody's standards. But Iam happy w who Iam and I'll die this way. Dueces!
139,13,Don't drive to cedar roads are so fucking bad..
140,13,Finally some cowboys haters! Where y'all been?
141,13,Prescott az cops suck!!!
142,13,Havasu is so damn hot!! ??
143,13,Fuhk whoever tryd to steal my truck and fuhk up the ignition and radio!! Amateur pos hope Carma fuhks you real hard!
144,13,i am almost 30 and this is the first time I ever voted! Gotta keep hillary out of the white house!! #trump
145,13,"Work,eat,shower,sleep...repeat"
146,13,I miss my friends and family so bad today...
147,13,Working Sundays are no bueno
148,13,I always give it my all even if its not enough..
149,13,"Fuck this wind, fuck Mondays and fuck you!!"
150,13,Can't make everyone happy..
151,14,This is why being a cowboys fan has been painful for awhile. Real classy.
152,14,Go Falcons!
153,14,ND is playing awful. Depressing.
154,14,Loving the rain and snow in St. George!
155,14,Haddie tree'd a coon.
156,14,Aggies! Thank you!
157,14,True Lakers hater here. Go Jazz!
158,14,"Excited for trick-or-treaters and most importantly, the Jazz game."
159,14,Riley Nelson is AWFUL.
160,15,Work ends and work starts.
161,15,Jenni help me do this!
162,15,3 generations
163,15,Saturday's walkabout!
164,15,Does anyone know a easy way to watch Game of Thrones ? hbo go i don't have a it.
165,15,Honey you once asked me if you could just push or kick a down power line. This shows how much power is above you and around you.
166,15,Does any know of a vizsla dog breeder or puppies for sale? in MN
167,15,Watch the sun set on freedom.
168,15,lll begin training this april and my cousin has agreed to join me! Let me know if you want to join!
169,15,I love my wife!!!
170,15,Half way threw the day and my wife and son are alive!
171,15,Wife has a fever and now she is asking me to stay home to take care of the baby..... if i said i don't know what to do? That would be giving me to much credit.
172,15,How did i get so lucky!
173,15,Still in labor everything is looking good!! 
174,15,"I'm so happy I'm alive! Wait that's every day that I'm thankful to be alive. I'm thankful for my wife my baby and the job that i have if your worried about anything put that date for tomorrow because death waits for us all, find christ and have no worries about death."
175,15,"Today at Walmart, I overheard a customer and a Walmart employee talking about how a lady could not buy a rifle because she couldn't get a background check because the phone line/system is completely backed up; Due to the horrible events of Friday. This is the first time I've ever heard of this happening. So many people are applying for first time gun ownership because of fear of losing the right to buy a gun."
176,15,"We are taking bets on gender, weight and length of Baby H"" :)!!!!"
177,15,Going to be a father thought #1371#(Teach my son or daughter to shoot and to start a campfire by the age of seven)
178,15,Ok i got a note from my wife saying its 37 weeks so it could be go time at any moment! So i installed the car seat and got the go bag all packed up!
179,15,My beautiful wife and I.
180,15,I love my wife so much. And she does the dishes too wow I'm so lucky!!!!
181,18,Happy Birthday to my beautiful wife Jess! ?? ?? 29 years young ??
182,18,Can't believe I'm already 25!! Time flies :) thanks for the happy birthday's!!
183,18,"Thanks for the B Day wishes! I had an awesome day! Started out at 5 in the morning, worked my butt off in the hot sun for 11 hours. Got home and my wife surprised me with a cake, my favorite avocado dip, and a massage over at massage envy! :)"
184,18,My two favorite nephews :)
185,18,"Well...... I NOW HAVE A FACEBOOK!!! My Wife thought that I should be part of the ""real"" world, so she took the liberty of creating an account for me :)
Now this is living:)"
186,18,ROFL!!!! For all you Apple lovers!!
187,20,Sunday hangout
188,20,We caught a dove in Grandma's Chicken Coop! it made this little guy's day??
189,20,Haha so fun! If your a harry potter fan!)
190,20,Carving pumpkins !)
191,20,Drink date;)
192,20,"Fall break ,
up
In pine Valley"
193,20,if you suffer from migraine headaches try this stuff out!
194,20,thinks its funny when people share their lives with facebook!)
195,20,had a good birthday! Half way to 30!)
196,20,i have a bad headache! i hate them!
197,20,Thank you so much to the Andelins we had a blast at your party!)
198,20,Is glad that facebook is around when i cant sleep
199,20,dont click on find out who visits Ur profile it will hack Ur computer
200,23,I'm 31 everyone! First of all thanks to my heavenly father for another year. Also thanks for the last 11 years for blessing me with my boys. Thanks for my family and friends. Could not have asked for anything else??
201,23,Baby wanted his oreo teeth to come out in the pic!
202,23,My lil brother! Carlos Sanchez
203,23,"we miss you alot, hope you're having a wonderful thanksgiving with your family :)"
204,24,"A family that screams at refs together, stays together! Such a fun weekend celebrating Camila s birthday!"
205,24,You know what this means! Our annual free hot chocolate and cookie stand! Stop by and partake! We are on Crimson Ridge Dr out in Little Valley! ??
206,24,Go snag a complimentary sign all y all!
207,24,Thank you @kassidybakerphotography for making Family Pictures an enjoyable experience (usually not the words one would use for family pics haha) And for providing us with these beautiful moments in time! ?? I love everything about these!?? 
208,24,These extensions are amazing! My cousin has done an amazing job creating a comfortable stylish design! Check them out!!
209,24,Brother and sister duo ?? cutest team around! Neighborhood talent show was a blast! 
210,24,My brother is a pretty amazing dad ?? I am blessed to even know people like Nick and Joy. But won the jackpot to be part of the same family! 
211,24,Our hearts are full of gratitude ??
212,24,"This happens to be my amazing niece!!! They had this surgery planned out for further down the road, but life threw a curve ball and they just found out they needed to move it to this Wednesday! 
I 100% believe in the power of prayer. I have felt it during the deepest struggles I ve had to endure. I know that sweet Nick and Joy (and my whole family for that matter??) would so appreciate any extra prayers that could be said for Emery and their family! Even if it s a 5 second prayer ?? it s totally worth it!"
213,24,"If anyone has tried to contact me in the last month, I am here to say that I am not a jerk and don t hate you! I promise I didn t intentionally ignore you ?? I successfully damaged my phone beyond repair in January and it has taken a few weeks to solidify the diagnosis ?? 
My phone is back now! So try again haha because I won t be receiving any previous messages sent to me. If I don t answer this go around, then it s probably because I m purposely ignoring you ??"
214,24,I sure like my friends. They are keepers for sure!
215,24,thanks everyone for the birthday wishes! They came true! I had a fantastic birthday filled with family and lots of fun!
216,24,thanks to my awesome husband for the great birthday gift! Love ya tj!
217,29,Happy Birthday Landyn. You are missed! 
218,29,1 year ago the girls ate lunch with Mr Clean!
219,29,Ally took the pic and i love it lol. I also love this woman. She is my best friend and so strong. She is my rock and we seem to balance each other pretty well. I love listening to her laugh even if its at my dry sense of humor . Had fun this weekend on our 4th easter celebrated together. Love you Brittany Emery
220,29,My love bug still sleeps so weird lol
221,29,When he is happy he is really happy but when he is mad he is MAAAAD! LOL
222,29,Lastnight i had the most beautiful young blonde walk in the front door with a new glow about her and may i just say.....damn that updo is ridiculous! Love you
223,29,He was so small and precious
224,29,"Ive been trying to get my records removed from The Mormon or LDS Church,or whatever they call themselves now,for a while. Funny to me that it takes LONGER to be REMOVED from the church then to get excommunicated or to Take all the discussions to get brain washed and baptized! Ive been quiet too long and now that i have kids im not going to let them get BRAINWASHED by the church like i was!"
225,29,750 friends down to 300! feeling great
226,29,I knew when i met brittany she came with "baggage" but now i have some of my own. ??
227,29,Every year we asked our mom what she wanted for her birthday and she would say "i want a clean house and happy kids". Well now that im older i understand it and i had just that for my birthday! It was so awesome spending it with my family. Thanks for everything Brittany Emery thank you all for the birthday wishes!
228,29,Cousins night coloring and playdough. 
229,29,Little dude is already a pussy magnet lol 
230,29,If Monday has you knocked down then watch this and get back up again! 
231,29,Our little drummer boy.
232,30,"i love my familise, i love my kids."
233,31,"I don t have a lot of words for the past 36 hours... My baby was life flighted to Primary Children s with RSV. Things are looking better right now. Thank you to all those who have reached out and are still reaching out! We have received so many tender mercies and are grateful for each and every one of you! We couldn t be doing this without your prayers, support, and encouragement!"
234,32,"i love my familise, i love my kids."
235,33,"United Hairlines is looking for a Full time nail tech, we also have a room available for aesthetics, massage, eyelashes, or permanent makeup. If you or anyone you know is interested please contact me. ??"
236,33,Cutest dang thing ever! Maybe Luke Bryan isn't so bad ;)
237,33,Thanks to Amy McAllister I am now addicted to rice cakes!! Haha
238,33,"""I need a drink...I'm going to throw up...I forgot to take my cough medicine...I'm going to throw up cause my throat hurts.. I'm thirsty.. My hairs too wet... I need my lamp on... My belly hurts"" My child... What will she come up with next? Just go to sleep already! Haha"
239,33,I love Miranda Lambert!! She looks amazing!!
240,33,Tavia says to me... "My farckles are hurting my face" I say "what's a farckle?" She means freckles! Haha love the things she comes up with!!
241,33,haha if were lucky ;)
