,0,1
1026,159,"It's official, I am in LOVE with my new phone. I am done living in the stone age of Internet-less phones."
1027,159,Guess who just rotated her own tires...yes I'm a big girl now :)
1028,159,"Just listed her first item on ebay. Wow, I feel like a big kid!"
1029,159,Right now I want to go to Serendipity and have myself a frozen hot chocolate. Too bad I'm not in New York :(
1030,159,"I should be doing homework, but making cookies sounds like much more fun."
1031,159,is in class having a panic attack...wow this is not at all pleasant.
1032,160,Thanks for all the birthday wishes...I love all of you!..I even love all of you who didnt!) ha
1033,160,Memphis...down 14 goin into 4th...let make a come back!
1034,160,OKC and MEM...crazy game...Double OT. Lets go Memphis!
1035,160,life is so crazy...
1036,160,Lets go Bulls...GettR Done!
1037,160,Sorry Pacers...You get an E for effort!
1038,160,Sold my car today....Huh... What now?
1039,160,C'mon Jimmer..we need shots before the red light!
1040,160,I saw Jimmer last night!...OMG!
1041,160,"I'm on the pursuit of happiness... & I know everything that shine ain't always gonna be gold. I'll be fine once I get it, I'll be good."
1042,160,"The worst thing about crossing a line, is when you don't know, you already have..."
1043,160,crazy...i got the hickups...how do u get rid of them?
1044,160,All I have to say is...Wow!
1045,160,Thanks everyone....Much Love! XOXOXOXOXOXO
1046,160,dang im hungry...
1047,160,My heart thump not from being nervous...Sometimes I'm thinking God made me special here on purpose.
1048,160,"All my life, wanna do something major. Now every little thing I do might make it in the paper!"
1049,160,just finished up my classes...pheeww!! barely made it!
1050,160,I guess if I was simple in the mind...Everything would be fine.
1051,162,Please help if you can!
1052,162,What's the best way to store a Memory Foam mattress long term without ruining it? Dave and I are at a loss.
1053,162,Snapchat is fun. Find me: denisemadsen. I'm on it way more than I should be ??
1054,162,"1, 2, 3, 9, 7, 10, 11, 8, 8, 8... This is how Presley counts. She's too cute for words!!"
1055,162,I need a good makeup organizer! I'm looking for something that sits on the counter. Any suggestions on where I can get one last minute?
1056,162,Thank you Charity for taking such pretty maternity pictures! Taken at 26 weeks.
1057,162,Having the hardest time coming up with a Thanksgiving menu.. I need help!! PLEASE share your favorite side dishes/recipes!
1058,162,Our truck got rear ended... Man we're having bad luck with cars this month!!!
1059,162,My car died today.. RIP Suzuki! A new car is in my near future though :)
1060,162,My poor sick little baby finally fell asleep!
1061,162,A free one hour massage? Yes PLEASE!! Thank you Image Sculptors :)
1062,162,"Over 7 inches of rain since Thursday! I'm loving it, but I'm not loving the sink hole in my front yard.. :/"
1063,162,"Ahh, I love getting my teeth cleaned! So fresh and clean. Thanks Abilene Advanced Dentistry. Best Dentist office EVER :)"
1064,162,My blogs going private! If you want an invite give me your email address :)
1065,162,"I love my job but man, taxes are depressing!"
1066,162,Just watched the final episode of Bachelor Pad.... Holy crap hahahaha awesome!
1067,162,The bathroom remodel is FINALLY finished. I LOVE it!!! :)
1068,162,Bachelor Pad sucks me in every season!! *sigh*
1069,162,Woke up today and decided I'm ready for Football season and Halloween.. Whaaaat?  :)
1070,162,"I'm in serious need of an updated wardrobe! What are some good stores to get cutesie, frilly tops? Online stores work too :)"
1071,162,Sometimes being an adult and owning your own home is SO hard and VERY expensive. So stressed right now! :(
1072,164,Like a child kicking and screaming...
1073,164,It's Pokemon profile picture month!
1074,164,Please read and spread awareness. We as students of DSU should not let this go without a fight.
1075,164,Finally got my headshots done
1076,166,Yes Props to Rachel Street for the amazing photo!!!
1077,166,I'll post pictures when he does :)
1078,167,"Like Amy's kids and Hanneman and his siblings, and Ryder...that pretty much sums them all up!"
1079,167,"Thanks! A little slow at getting them up....just about 4 months old, buuut hey thats ok! And yeah this one girl I know that has really cute taste in clothes got it for me! ;)"
1080,167," I love that outfit, but the bottoms were so big on him at the time, totally makes him look out of proportion! ha"
1081,167,lou who....you love his long hair!
1082,167, You all are being entirely too kind.
1083,167,I'm dying over the fact my kid gets baptized in less than a month!!!
1084,169,Thank you so much everyone. We are so happy! We decided to do the elopement thing! And it was perfect! Thank you so much for all the well wishes we are so lucky to have such amazing friends and family.
1085,169,Pretty much have the coolest people in my life! Came home from a long day of work to find my house very tidy :) Thank you so much Steffany Duncan for cleaning my house. It means so much.
1086,169,"I am pretty dang happy, that s for sure! Hopefully one day we will be able to meet up!"
1087,169,I am truly happy. It was so fun to see you and your beautiful little man! Hopefully we can get together again!
1088,169, Life is to short to sweat the small stuff! I do not feel hurt by you at all! So many things have changed in my life for the better. Thanks uncle Dean! I love you and that has never changed.
1089,169,Well today was the last day of a going on 6 year run with Applebee's. I loved every single one of my apple buddies and I wish you all the best of luck you were like family to me.
1090,169,"I know I promise I am done for the day, But come on people we have a problem!"
1091,169,Summer time!!!!
1092,169,I am obsessed with TED talks !! Everyone should watch them! Go on YouTube now! It's kinda a big deal! :)
1093,169,I have been dizzy for two days!!! Any suggestions on how to stop being dizzy!! Going a little crazy.
1094,169,Beach run.....I think yes!!
1095,169,"Eat, pray, love!"
1096,169,Girls day downtown!! We are on a good one!
1097,169,I think I am going to start wearing work out clothes everywhere I go. maybe then I will convince my self to WORKOUT!
1098,169,Have I said before how much I love the rain!!!!!!!
1099,169,"Awww this is the life! Beautiful day. Hiking, beach subway and just a touch of football."
1100,169,Today feels like a run on the beach kind of day!
1101,169,Early morning Christmas party with the applecrew today! Yikes it's so early!!!!
1102,170,Waiting for Hyundai to finish my cars first oil change.
1103,170,"Guns dont kill people, people kill people."
1104,170,Cleaning out the pantry.
1105,170,I went to Which Wich and got the best sandwich I have ever had in my entire life.
1106,170,At the doctors office with the wife
1107,170,I would like to work on my online class right now although the schools server is down...
1108,170,Nitro is totally crazy!
1109,170,I bought a new puppy his name is Nitro!
1110,170,I sure hope the new Robin Hood kicks butt!
1111,170,It is crazy hard to type with a big cast thingy on your wrist.
1112,170,Utah's weather is on CRACK!
1113,170,Curse you snow!!!
1114,170,I hate early mornings.....Dang you Ethics and Values Class!!!
1115,170,School starts in two days.....SUCK
1116,170,Last final today HECK YA!
1117,171,unstantext
1118,172, Sheridan made it totally better!
1119,172,Happy Dirty Thirty to my longest time bestie! No matter how long between visits it's like there was no time at all. #letsgotothebeach love you Sara!
1120,172,Playing mermaid
1121,172,This stuff is better with friends. 
1122,173,"Words cannot even begin to express how truly grateful I am to be this sweet boy's momma. I never could have imagined how much he would change my life, but it is some much more than I could have ever asked for!! I am so blessed!! I can't wait to see what the future holds!! :)"
1123,173,"Awe, this was a fun trip. I have some fond memories from that day!! ??????"
1124,173,the relationship they have is the absolute sweetest!! This Brotherly love is a wonderful thing to get to watch blossom. ?
1125,175,I officially start my first day of grad school tomorrow! Wish me luck!
1126,175,can't believe it's already been a year! I'm so excited to celebrate with my amazing hubby in Vegas for our ONE YEAR ANNIVERSARY!
1127,175,is tired of unpacking! But I love our new apartment!
1128,175,Wow! Thank you everyone for all the birthday wishes! I had such a great birthday!
1129,175,loves the married life!
1130,175,"I don't understand why someone would vote for Obama, especially after watching this video!"
1131,175,Saw the Broadway Show "Wicked" in Las Vegas last night! It was AMAZING! Such a nice break from my crazy hectic life!
1132,175,"Feels great to be home and sleep in my own bed! Now time to clean, unpack and organize!"
1133,175,"I can't believe the end has come! I saw both of my clients for the last time, packed and cleaned the apartment, and tomorrow we go home to St. George! I am so excited to see my family and friends!"
1134,175,I am feeling good! My finals are over and my first year of grad school is complete! Now time to relax until I start my summer course of Neuropathologies in 10 days!
1135,176,Do any of my beloved facebook friends have a stand-up dresser they are looking to get rid of or sell?
1136,176,Thank you everyone for the birthday wishes! 
1137,176,Thank you everyone for the engagement congratulations! I'm a blessed man!
1138,176,"My 2 week training was good. I learned a lot met some Interesting people, and had some good conversations, but I'm glad to finally be coming home this morning."
1139,176,I love a wonderful woman named Gerilyn!
1140,176,"I saw Big Boi in concert tonight, never thought I'd say that."
1141,176,Anybody good at installing car stereos?
1142,176,Anybody wanna go see Harry Potter with me real soon? Anybody?
1143,176,Long weekend of drill and now crashing.
1144,176,If anyone wants to come hiking tomorrow morning around 7:00 out to RedRock let me know. If you need a ride I can come get you.
1145,176,Got my new ESV Study Bible in the mail today. Super awesome but I need a dollie to carry it around though ;)
1146,176,Going on a hike around 0600 tomorrow morning if anyone wants to come.
1147,176,I love my Monday night smallgroup.
1148,176,Playin' halo reach with my two little bros. Good time.
1149,176,Lovin' the weather this morning in Vegas.
1150,176,"I think I'll play some CoD, even though I suck pretty bad after taking 4 months off."
1151,176,Just finished all my training today! I'll be home tonight after 18 weeks in good ol' Kentucky and I can't wait to see everybody!!
1152,176,On a much needed break from basic training with my dad here in Kentucky. Ill see you all in just seven more weeks!
1153,176,I think I'll go ahead and get off the internet for a week so I can focus on my life... goodbye cruel virtual world..
1154,176,I know I'm way behind with the program but I went and seen Avatar today and it was AWESOME!
1155,176,I just officially finished up the last class of my second year of school!!
1156,179,Had a blast at Flaming Gorge over labor day with the fam!
1157,179,Misses my husband!
1158,182,nonstantext
1159,184,"South Carolina was amazing! So honored and privileged to be invited to National President's Cup. Great learning moments, great group of referees and mentors, and some great games!
Thanks Kaesha Fry for letting me attend! #supportivewife"
1160,184,"If anyone is interested in a great part time job, usually afternoons and saturdays. Hit me up. Soccer enthusiasts will love this part time gig... "
1161,184,I had a great weekend learning and honing skills for reffing! Looking forward to the National President's Cup 2014 in SC! #STOKED
1162,184,Looking forward to another weekend of travel with the family for some officiating! woot woot!
1163,184,Jay Hutchinson wish you the best and that everything goes smoothly!
1164,184,Jay Hutchinson wish you the best and that everything goes smoothly!
1165,184,Great experiences being on the field with National Referee Alex! Learned some really great things today in the world of officiating!
1166,184,Another weekend without my loved ones by my side. :(
1167,184,Enjoying the last two weekends officiating. But totally miss the true loves of my life... Kaesha Fry and our handful ;) JT!! So glad to see them tomorrow!
1168,184,I hope that today they will be gone! ... such a headache!
1169,184,Happy happy birthday to my wonderfully perfect wife! Can barely wait for her to open her gift! Such a great surprise!
1170,184,what would you think if your teacher gave you a red or yellow card in class?
1171,184,Three red cards given... woof! I can't believe the last two
1172,184,It can be frustrating when the world as much as they say they wish it was different but continue to function under the notion of: "it's who you know not what you know" or in my case not what you do or how well you do it...
1173,184,Excited to officiate another game of the best sport in the world. I'm glad to still be around it constantly!
1174,184,Slightly burnt from a good game of officiating soccer! Love that game!
1175,184,"You know at first i was sure that my but would just kill for already riding about 20 miles, but it only hurts the first like 100 yards when you get on the bike! hahaha"
1176,184,I'm going to have a little me! how crazy is that!
1177,184,My parents are home!!!! They speak next week if you are interested!
1178,184,"So I, I must say I'm expecting a little FRY. Kaesha is Pregnant!"
1179,184,My parents will finally return from their mission on July 1! So excited to have my dad finally meet my wife!
1180,187,I'm grateful for the friends that I have here today and anyone else that has been helped by this service and others like it. Let's take care of each other everyone. 
1181,187,"Peach Pit totally took over 2018, other than that I can't say I've changed much, but I'm proud of that."
1182,187,Busy day with baby checkups and other appointments.
1183,187,"Moments away from release. Baby Jones is going home!

...Paperwork..."
1184,187,It's nice having a phone again. To anyone who may have texted me while my other phone was dead: I'm sorry. Go ahead and text me now. :)
1185,187,100% on my statistics final? Don't mind if I do.
1186,187,Ahh! Everyone at my school is using Internet Explorer!
1187,187,"I've spent all month on a wait list for a college course I need to take. I just logged on to check my wait list status and discovered that my number had come up and gone just yesterday, the one day that I didn't check in the past month. I missed the window by one hour. :( Now I'm in position 19."
1188,187,"Thank you everyone for the birthday wishes. You're all awesome!

And thank you to Facebook for putting all of those birthday wishes into one place so it only took a matter of seconds to 'like' them all. You da real MVP."
1189,187,I get so much stuff done on mornings that my carpool is running late! All the stuff I put off doing all weekend long is now mostly done.
1190,187,"Just passed my first Praxis exam. I am now Highly Qualified in High School Mathematics.

Now I just need a teaching license..."
1191,187,"""I'm a *bearly* contained ball of rage.""
...I'm definitely not okay with that."
1192,187,is stoked for his wife's Christmas! Can't wait for her to open her gifts and flip out.
1193,187,hasn't been so active on Facebook in a long time.
1194,187,is sorry to everyone who probably thinks he's shafting them because he didn't answer their texts yesterday. His phone died and therefore was unable to respond.
1195,187,"made the long, arduous journey to retrieve his phone, but arrived only to see it's final words, ""Low Battery, Power Down"" before it passed on to phone heaven for the day."
1196,187,Is finally gonna be able to do some Christmas Shopping and is pretty stoked about that.
1197,189,"Just watched 17 miracles. It was the saddest movie I have ever seen, but so inspirational."
1198,189,"i love my familise, i love my kids."
1199,190,I was thinking I get to spend the rest of my life with my best friend!!
1200,190,Because we are! He is amazing and I couldn't ask for a better husband.
1201,190,My hair has always been a favorite of mine too!
1202,190,I was just happy to take a picture of myself with no foundation because my skin is finally clearing up
1203,190,Poor you when my fist meets your face >:|
1204,190,This is awesome!
1205,190,The jolley ranchers would never make it to the oven momma
1206,190,Does anyone know what these verizon points are all about? I have a lot but don't have a freaking clue what they are for!
1207,190,"Looking through my news feed, when did Facebook become a porn site, seriously guys it's getting gross.."
1208,190,"No one to hang out with tonight.. BOO, I need my Rachael, she would hang out with me."
1209,190,Fun time with the hubby and puppies
1210,190,"Anything to help out my wonderful cousin and her baby girl would be awesome, please!"
1211,190,Did my hair all cute then read about a flash flood warning for the next two days.. Awesome!
1212,190,"Chaaaarrrlie..... You can never come back.
Name that movie!"
1213,190,Who has two thumbs and won $100 on a Planet 941 contest?! THIS GIRL RIGHT HERE!!!
1214,194,Mommy's stud muffin!!!
1215,194,"You know when you give give give and in the end your tossed aside. Im not sure why but that keeps happening to me. I'm just thankful I have my hubby, kids and family because it's honestly depressing.
#havingabadday"
1216,194,So pretty!
1217,194,Driving back from Texas made it to Arizona yay! Still along way to go yet!
1218,194,Almost done driving!!!! 18 hours!!! Me bum hurts........ TEXAS
1219,194,Just me tonight! What to do?
1220,194,Been super sick going on five days now. Woke up this morning and my face is swollen. Hate hate hate being sick!
1221,194,Couldn't have asked for a better husband and father to my two beautiful boys! Thanks for everything you do. We love you so much! ???
1222,194,About to get my workout on with Margarita!!! Kicking butt and taking names ;)
1223,194,Helped coach my son's baseball team today! So dang fun!!! So proud of Weston!
1224,194,This is my studdly little baseball player. He had his first game today! Im such a proud mommy and I'm also proud of the assistant coach Daniel Burke.
1225,194,"Pool, margarita and sun shine is what this girl needed!!!"
1226,194,Weekend with the hubby and friends in mesquite!
1227,194,So it figures the day I plan to get a pedicure I break one of my dang toes but did it stop me.....NO! I got a pedicure and went to the gym! No wimp here!
1228,194,"Gym, made breakfast, kids played with friends and did a lot of talking because I seem to never shut up. I was also up super early and now im starting to feel sleepy very sleepy......"
1229,194,Busy but productive day! Got a lot done and tomorrow will be just as busy and productive! Im in the need of a day in the sun lounging next to the pool. Yup yup!!! :)
1230,194,Having more energy and feeling stronger has done wonders in my world and to my confidence because face it ladies nothing is sexy then confidence. #lovinlife#gymlife#fitandhappy#beastettemode.
1231,194,Chili's is looking for cooks!!! If you know of anyone or are interested yourself hit me yup.
1232,194,Happy Birthday amazing lady! Love your face!!!!
1233,199,nonstantext
1234,200,Had so much fun in Denver with our friends!!! Now time to sleep!!!
1235,200,Is it free to check bags on Southwest?
1236,200,I wish I was 39 weeks along!! So sick of being sick!!!
1237,200,I think I give up on the Colts this year!!
1238,200,How do you even BEGIN to pick a baby name???
1239,200,3 years married today to Mr. Zachary Lundgreen!! Such great times. Happy Anniversary babe!
1240,200,"Husband is gone, my dog is gone! Both out camping.. It's to quiet around here!!"
1241,200,Lake Powell was great! Lots of fun with the family!!! Now can't wait to get home in Park City again!!
1242,200,Can't wait to be back in Park City cutting hair on Tuesday!!!
1243,200,Wow wow wow friends.. Thanks for all the birthday wishes!!! It was a GREAT day!!! You da best!
1244,200,you are a BABE.. haha remember Zach taking these maybe he was on a Little to much meds??
1245,200,so help me figure out pinterest??
1246,200,How come I can't even figure out SKYPE??
1247,200,How do I change a background on a blog??
1248,200,"I need a good book to read any suggestions??

P.s. I am not a wizard vampire fan"
1249,200,My moms better than all y'alls!!!! Love you Momma Kraupp
1250,200,"Driving to Texas!! Last night went through Utah, Nevada, Arizona, and New Mexico!! Now through the big big state!!"
1251,200,Such a great great wedding last night of Mo & Chase... So fun to see family and old friends!!
1252,200,Why is everyone obsessed with this royal wedding business???
1253,200,Last day of work...sad!!! I will miss all you girls!
1254,201,Sick Halo clips
1255,201,Bad ass
1256,201,I'm so excited!! Can't wait to go!!
1257,201,I need a switch now!!
1258,201,Im feeling excited this morning im in Las Vegas at a BIG flea market. Im on a mission to hunt down some retro video games to build my collection ??
1259,201,One of my favorite games of all time
1260,201,Im excited for fall!! Bring it on fall im ready!!! ????
1261,201,Looking for a job if anyone is hiring let me know please i need a job asap
1262,201,My wife is gone for today(will miss you!!)... so if anyone wants to come over and game it up let me know ??
1263,201,Having toothache is the worse I could not sleep at all for the past 2 days and hopefully today I'm getting my tooth pulled
1264,201,fuck u all :)
1265,201,alot of crazy shit went down this week in the NFL
1266,201,is a sad day today
1267,201,i hope something good will happen...but who cares!!
1268,201,time to party i got this Saturday OFF! HELL YEAH
1269,201,i dont get it why people have to be a fucking bitch
1270,201,yesterday was a shitty day getting off work and riding on a scooter through the rain not fun
1271,201,hell yeah to star wars day!!!
1272,201,why the hell do i go on to facebook!!!! and what the fuck im i still on this earth
1273,201,holy shit
1274,201,its sucks not having a car
1275,203,nonstantext
1276,204,Magnets are awesome
1277,204,"Having fun with friends, Cody Hatch and Todd Julian spent the day fabricating this amazing creation."
1278,204,Carved some pillars for a local contractor
1279,204,Started going through my wood supplies and bucking up the stuff that I am not going to use for carving the pile is growing quickly
1280,204,In case you are exhausted of calling him trump ??
1281,204,"Having a fire pit in your back yard is a wonderful thing. Had a carving that I was over 12 hours into fall of my sawhorses and crack in half yet thanks to a nice relaxing fire involving smoked sausages and smores, I now feel content."
1282,204,"Got the backyard project a little further, plus got shade sails and misters put up on the deck"
1283,204,"Enjoying some morning coffee at jazzy, the question is what to do for the rest of the day.... well where to go hiking/exploring to be more precise"
1284,204,coffee in the morning
1285,204,When life gets crazy just remember that a calm head always beats the crazies
1286,204,made it to southern utah from Salt Lake without my car having issues
1287,204,Getting ready for a 5 day camping adventure :)
1288,204,park + hammock = best way to spend lazy afternoon
1289,204,ok my day just went from blah to bad :(
1290,204,Apparently I still have to buy another tool to fix my car.
1291,204,"well unfortunantly due to work, I will have to wait yet again to get my car running"
1292,204,"driveway is free of snow, though there is nearly a foot on the road....."
1293,204,"Today is the day that I prove my toaster oven is all mighty. A game hen, portobello mushrooms, and an assortment of other random vegetables will be made to fit and I will be victorious. :)"
1294,204,looks like it might be yet another quiet saturday evening :/
1295,204,"it has been a rather pleasant evening, now the question is what to do with the rest of it......sketch,paint.......maybe build a new electronic cigarette......."
1296,207,"Her name was Roya Jade, it was a LivingSocial coupon deal last year."
1297,207,"This is Peru, up above Machu Picchu (which you can kind of see behind us) along the Sun Gate Trail."
1298,208,"Last day to sign up, would love to see you guys there! Plus I'm bringing treats??"
1299,208,"I am so excited to announce that we are starting make it take classes in Yuma, Az!"
1300,208,"Hey friends I usually don t put my little business stuff on here, but if anyone has been looking for fabric pumpkins I have a sale going on today only."
1301,213,"Thats always good to be alive. How you feeling, you working still"
1302,213,I think the broncos just need to throw in the towel and forfeit. 5 int and 22 to zip thats an @ss wooping at home
1303,213,"Michigan? Not even close, I've never even been there."
1304,213,No shit! Now a days your damned if you do and damned if you don't.
1305,213,There's always a silver lining!
1306,213,Yum!!!
1307,213,This is bitchin!
1308,213,"""In a moment of pure frustration today,I came to the conclusion that there is no angry way to say 'BUBBLES'..."""
1309,213,The new drink the fuh
1310,213,Really wish I could have this baby sometime within the next couple of days. Little shit wants to keep warm
1311,213,Does anyone know of any tricks to try so me and the wife can have this baby.
1312,213,"Did you know when you eat the center of a donut, it has no calories?"
